sequenceID,text
1,that's funny. No. I let him roam around the house.
1,Can't believe he grew up so quick
1,"Yeah, kids grow up so quickly "
1,What do you usually do when he visits?
1,"We will probably just spend most of the time here at home, no big plans really."
1,What does your turtle eat?  Is it hard to take care of a turtle?
1,I understand. I think we will do the same. I hope he brings a few of his friends. I am not that old... if you know what I mean :)
1,"He eats insects, leaves and sun flower seeds. It's easy. They don't need walking and cleanup is simple. Do you have any pets?"
1,"No, not at the moment.  I have 3 girls and they are enough trouble! LOL"
1,You're only as old as you feel is what I say.
1,"Yes, that's exactly right! If you don't mind me asking, have you ever considered any of your son's friends? ^_^"
1,"Not really since I am usually spending my time alone in my studio painting, but I might give it some thought."
1,Congratulations. Do you come from a big family?
1,"You should. I am not really a blond, but I would say cute and the kids dig me. :) And you know, sometimes I let them play with me"
1,"Well everyone is an adult so who am I to judge, sounds like a good bit of fun to me."
1,"I don't, just 2 siblings.  But my wife wanted a lot of kids. So, there you go."
1,"What are you up to now, girl?"
1,Just about to clean up my paints and and put them away for the day.
1,Wow. cool. How often do you use computers?
2,Can't believe he grew up so quick
2,Canning is great for storing food. Sometimes I can food before my marathons to calm my anxiety.
2,"Yeah, kids grow up so quickly "
2,"Wow, you've done a marathon?  I run a bit, but never tried anything long"
2,What do you usually do when he visits?
2,Yeah it's a great way to keep your heart healthy! I wish the marathons were in the evening though. Are you a morning or night person?
2,I'm totally a morning person.  I wake naturally around 6 a.m. And you?
2,"I wake up at 6 a.m.when I have work, sometimes I'll get up at 5 a.m. though for a morning run."
2,"We will probably just spend most of the time here at home, no big plans really."
2,"So, how long and how far is your morning run?  And when you prepare for a marathon?"
2,"Generally I'll run about 3 miles, but when a marathon is coming up I'll build my way up to 5 or 7 miles every morning."
2,I understand. I think we will do the same. I hope he brings a few of his friends. I am not that old... if you know what I mean :)
2,That's impressive.  I would like to try but I just don't have the stamina! Do you ever run with a dog?
2,You're only as old as you feel is what I say.
2,"Yes, that's exactly right! If you don't mind me asking, have you ever considered any of your son's friends? ^_^"
2,"I don't have a dog, I just don't have the time to dedicate to a pet! Do you have any pets?"
3,Canning is great for storing food. Sometimes I can food before my marathons to calm my anxiety.
3,How would I start rock climbing?
3,I would suggest a fitness place with a rock wall.  Try that out in a safe environment
3,I will do that. I will take my mom with me since she is my best friend.
3,"It's good to have a spotter! Also, get in overall good shape with an emphasis on balance"
3,"Wow, you've done a marathon?  I run a bit, but never tried anything long"
3,Where should be go after the fitnes place? Would the ocean be a good spot?
3,Ha ha - not for rock climbing.  Maybe you are thinking of diving?
3,Yeah it's a great way to keep your heart healthy! I wish the marathons were in the evening though. Are you a morning or night person?
3,I was thinking about diving. I would love to see some real life mermaids.
3,You may need to limit yourself to Disneyland for mermaids.  They're not actually real.
3,I'm totally a morning person.  I wake naturally around 6 a.m. And you?
3,"I wake up at 6 a.m.when I have work, sometimes I'll get up at 5 a.m. though for a morning run."
3,"So, how long and how far is your morning run?  And when you prepare for a marathon?"
3,"Generally I'll run about 3 miles, but when a marathon is coming up I'll build my way up to 5 or 7 miles every morning."
3,That's impressive.  I would like to try but I just don't have the stamina! Do you ever run with a dog?
3,Thats not true. My mother told me they really exist.
3,"I don't have a dog, I just don't have the time to dedicate to a pet! Do you have any pets?"
3,I see.  I wonder where she has seen them?
3,"No pets, just a crowd of feral cats from the neighborhood that roam through the yard. Fun to watch."
4,How would I start rock climbing?
4,I am excited. I just hope they can get through today then the rest of the week will be easy.
4,I would suggest a fitness place with a rock wall.  Try that out in a safe environment
4,I will do that. I will take my mom with me since she is my best friend.
4,"I'm sure you'll do great. In second grade, that's where the kiddos will begin learning mathematics and science and social studies among other subjects"
4,"It's good to have a spotter! Also, get in overall good shape with an emphasis on balance"
4,Where should be go after the fitnes place? Would the ocean be a good spot?
4,Ha ha - not for rock climbing.  Maybe you are thinking of diving?
4," I really don't know anyone around, but most of this neighborhood is young. What do you do for work?"
4,I work for a Mexican cartel that kidnaps 1st graders and sells them into slavery... ;) Just kidding
4,haaa. well no one works if they don't have to. I took a year off traveling last year.
4,I'm only kidding lol. I am a veterinarian. I love dogs and cats! Well and children too :)
4,I was thinking about diving. I would love to see some real life mermaids.
4,"cool. the only dogs and cats I see are dead, embalmed and on display. Guess where I work?"
4,You may need to limit yourself to Disneyland for mermaids.  They're not actually real.
4,Thats not true. My mother told me they really exist.
4,The morgue! ROFL
4,I see.  I wonder where she has seen them?
4,"haaa, a museum."
4,She saw them when she was younger. I will believe my best friend since I know my mother well.
4,Far be it to argue with anyone's mother!  Do you have siblings?
4,"That was my second guess :) but it was too late, I pressed the Send button"
5,I am excited. I just hope they can get through today then the rest of the week will be easy.
5,It's really great to have the memories.
5,"I'm sure you'll do great. In second grade, that's where the kiddos will begin learning mathematics and science and social studies among other subjects"
5," I really don't know anyone around, but most of this neighborhood is young. What do you do for work?"
5,What do your kids look back at the pictures you kept of theme over the years
5,I work for a Mexican cartel that kidnaps 1st graders and sells them into slavery... ;) Just kidding
5,Usually pictures of their families and their pets that they love so much.
5,haaa. well no one works if they don't have to. I took a year off traveling last year.
5,"Pets are part of the family like humans, what typ of pets do you have if any"
5,I'm only kidding lol. I am a veterinarian. I love dogs and cats! Well and children too :)
5,"cool. the only dogs and cats I see are dead, embalmed and on display. Guess where I work?"
5,I have one cat but I want to get another! Do you have any pets?
5,The morgue! ROFL
5,"haaa, a museum."
5,"That was my second guess :) but it was too late, I pressed the Send button"
5,"I have 2 dogs, oreo and cupcake, they are goldendoodles"
5,It's amazing. but it's the only people I know here. recommend any restaurants?
5,"Wow, I've never heard of goldendoodles before. That's a bit hard to pronounce with my accent!"
6,It's really great to have the memories.
6,Mine is green.
6,"Thats cool, most shades of green are named after plants."
6,What do your kids look back at the pictures you kept of theme over the years
6,Do you like this time of year? I like the change in seasons but not very fond of the cold weather that comes in winter
6,Usually pictures of their families and their pets that they love so much.
6,I like it. I wish the weather was a nicer. Winter lasts too long?
6,"Pets are part of the family like humans, what typ of pets do you have if any"
6,I have one cat but I want to get another! Do you have any pets?
6,"Winter does feel like it can drag on, I just try to remember the next season is spring, I like spring the weather is great late spring"
6,Have you ever visited any other cities? I may go on a trip this winter.
6,"I have been to many cities around the world, try to avoid cities that have rainy seasons or get too cold in winter"
6,right. the rain can ruin a whole day if trying to explore a city.
6,"Yes some cities, get flooded like Venice in winter or get too cold like northern ctiies in Europe, America and Canada"
6,"I have 2 dogs, oreo and cupcake, they are goldendoodles"
6,i know what you mean . flooding is not something i like to deal with .
6,"Wow, I've never heard of goldendoodles before. That's a bit hard to pronounce with my accent!"
6,"They are a cross of a poodle and golden retreiver, they make great family dogs, kids love them"
6,"That sounds so cute. My kitty could really use a friend, maybe I'll get a goldendoodle!"
6,It's a good way to get a cheap flight or hotel but it's not for me either
6,Cats can be picky if you do get one get a puppy so they get along
6,"yes, I use a few apps to check flights, but Priceline or Expedia still have the best deals."
7,"Ok that's interesting, how do you know about that?"
7,Wow that is a lot. I've definitely seen plenty when I holiday at Lake Michigan
7,That is a nice place to holiday. Lake Michigan is so big!
7,Yeah it really is! Where do you go on holidays?
7,We like to explore around New England but our favorite holiday spot is in the Virgin Islands National Park.
7,Hershey's is the pinnacle of chocolate and have been relevant for years and years.
7,"I don't eat much chocolate, I try to keep in shape for Cross Country"
7,"Oh cool, i've always wanted to go to the Virgin islands, I love seafood so think it would be a great place to try some"
7,Everything is good in moderation. I personally believe eating too much of something is the issue here.
7,I love seafood too! What are your favorite types of seafood?
7,lobster and shrimp definitely!
7,"I agree, how much Hersheys do you eat?"
7,Yum! I LOVE shrimp so much.
7,How do you cook them?
7,I'm not a great cook. But I love to order shrimp dishes at restaurants. 
7,"Being from Georgia, I developed quite the sweet tooth in my younger days. However now I tend to have a Hershey's once in a while."
7,Sounds like you had a great childhood then!
7,Yeah restaurants do them better than I ever could
7,You could say that. What was your childhood like?
7,Are there any other types of seafood that you like?
8,Wow that is a lot. I've definitely seen plenty when I holiday at Lake Michigan
8,long time
8,It is impressive.
8,Thank you!
8,Do you take any mediciation?
8,I like the color purple
8,I love the color blue.
8,Blue is nice! What is your favorite animal?
8,My favorite animal is dog and some other animals as well.
8,I love dogs. We have one his name is Charlie.
8,That is a nice place to holiday. Lake Michigan is so big!
8,Yeah it really is! Where do you go on holidays?
8,We like to explore around New England but our favorite holiday spot is in the Virgin Islands National Park.
8,that's amazing he's a family pet and a guard dog
8,"Oh cool, i've always wanted to go to the Virgin islands, I love seafood so think it would be a great place to try some"
8,I love seafood too! What are your favorite types of seafood?
8,lobster and shrimp definitely!
8,Yes he is a Golden Retriever so he can bark loud
9,long time
9,Thank you! She's going to name him Cameron.
9,It is impressive.
9,Do you have any other siblings besides your sister?
9,An older brother was well. What about yourself?
9,Thank you!
9,I do have a younger sister as well.
9,Do you take any mediciation?
9,I like the color purple
9,Nice! Are you an aunt or uncle yet?
9,Yes I am.
9,That's exciting! Do you have a niece or nephew?
9,"As a matter of fact, both!"
9,I love the color blue.
9,That's awesome. Any tips?
9,"the most i can say is , budget . i know it isn't much advice ."
9,Blue is nice! What is your favorite animal?
9,My favorite animal is dog and some other animals as well.
9,Anything helps I appreciate it. Have you been keeping up with politics lately?
9,I love dogs. We have one his name is Charlie.
10,Thank you! She's going to name him Cameron.
10,"I am surprised how many reality tv shows are on air, what's your favorite type"
10,i like ones that aren't too scripted. there's one from japan called terrace house that is nice
10,"I like the outdoors type, the ones based in Alaska are interesting"
10,Do you have any other siblings besides your sister?
10,"i have seen cop shows based in alaska, there's a lot of socioeconomic issues up there"
10,An older brother was well. What about yourself?
10,I do have a younger sister as well.
10,Nice! Are you an aunt or uncle yet?
10,Yes I am.
10,That's exciting! Do you have a niece or nephew?
10,"As a matter of fact, both!"
10,That's awesome. Any tips?
10,I think like many reality shows they exaggerate how bad things are for ratings
10,"yeah, for sure. they make their own narrative to make a more interesting watching experience"
10,"the most i can say is , budget . i know it isn't much advice ."
10,Anything helps I appreciate it. Have you been keeping up with politics lately?
10,Some of the home improvement reality shows are interesting but they make their job look easier than it is
11,"I am surprised how many reality tv shows are on air, what's your favorite type"
11,Really? That has been around for awhile then.
11,Yeah isn't that crazy. I love geysers. Have you ever seen one in person?
11,i like ones that aren't too scripted. there's one from japan called terrace house that is nice
11,One time I was in a large group of people but couldn't get a very good look because of all the tall people in front of me.
11,"I like the outdoors type, the ones based in Alaska are interesting"
11,"i have seen cop shows based in alaska, there's a lot of socioeconomic issues up there"
11,Oh no! I am pretty tall so I don't have that problem. Except everyone looks at me funny in public.
11,I think like many reality shows they exaggerate how bad things are for ratings
11,"But, you can always grab things off the top shelf. That is a challenge for me!"
11,That's true. It has lots of advantages! Do you like hiking?
11,I do right now especially. The trees are all so pretty. I love the red leaves.
11,"yeah, for sure. they make their own narrative to make a more interesting watching experience"
11,I love it when the leaves turn colors.
11,I would love to go to New England to see the leaves in the fall sometime. I hear it is very pretty. 
11,Some of the home improvement reality shows are interesting but they make their job look easier than it is
11,I went there once about 4 years ago in the fall. It's so beautiful!
11,Did you hike there?
11,I did yes! It was spectacular.
11,it looks easy when they can condense months of work into 30 minute - 1 hour episodes
12,Really? That has been around for awhile then.
12,I do enjoy a good horror movie and then humor after.
12,Yeah isn't that crazy. I love geysers. Have you ever seen one in person?
12,I like to watch dark comedies like Barry on HBO starring Bill Hader. It's funny and has some dramatic parts to it.
12,He is very humorous and make good stand up points.
12,One time I was in a large group of people but couldn't get a very good look because of all the tall people in front of me.
12,Oh no! I am pretty tall so I don't have that problem. Except everyone looks at me funny in public.
12,Yeah gotta love Bill Hader. Have you seen his series of mockumentaries called Documentary Now?
12,"No I have not, do you recommend to watch?"
12,"But, you can always grab things off the top shelf. That is a challenge for me!"
12,"It's hilarious, just wish I had more time to watch his stuff"
12,Guess I will have to binge watch the series to get caught up with everything.
12,That's true. It has lots of advantages! Do you like hiking?
12,What are you fave shows to binge watch?
12,I do right now especially. The trees are all so pretty. I love the red leaves.
13,I do enjoy a good horror movie and then humor after.
13,"lol i cant even do it with the quad kind, i just fall over anyway"
13,I fall from time to time as well
13,for some reason tho the time i went ice skating i was totally fine 
13,I prefer ice skating rings with rails just in case I fall I can grab on to something
13,I like to watch dark comedies like Barry on HBO starring Bill Hader. It's funny and has some dramatic parts to it.
13,He is very humorous and make good stand up points.
13,if they don't have those you can always use your friends 
13,Yeah gotta love Bill Hader. Have you seen his series of mockumentaries called Documentary Now?
13,"Yes that's true, I just wouldn't want them to fall with me either"
13,"yea i feel that. tho i think when i was younger i wouldn't think of that at all, since falling over is not as big a deal lol"
13,"Yes, me and my friends took more risks when we were younger, not taking that chance now"
13,"No I have not, do you recommend to watch?"
13,"It's hilarious, just wish I had more time to watch his stuff"
13,it would feel real bad to have to deal with a like serious injury over something as silly as that 
13,Guess I will have to binge watch the series to get caught up with everything.
13,"Yes, even moving large furniture, I would rather have professionals move it than risk hurting my back"
14,"lol i cant even do it with the quad kind, i just fall over anyway"
14,"No not at all, I have plenty of male friends"
14,I fall from time to time as well
14,I think that is a good thing.
14,for some reason tho the time i went ice skating i was totally fine 
14,I prefer ice skating rings with rails just in case I fall I can grab on to something
14,"Yeah, although now you have me thinking about it, I don't think I am very comfortable about how much time he spends with her..."
14,I can see why that would bother you.
14,if they don't have those you can always use your friends 
14,"haha yeah, so how about you, do you have a partner?"
14,Yes I do have a partner and I am comfortable with him having females friends.
14,That's great to hear. What's your favorite activity to do with him?
14,We both love riding motorcycles and playing put-put.
14,"Oh cool, i have played put-put a few times but I'm really bad at it"
14,"Well maybe you can become better at it, if it's something that you enjoyed"
14,"Yes that's true, I just wouldn't want them to fall with me either"
14,Yeah I would like to try again
14,"yea i feel that. tho i think when i was younger i wouldn't think of that at all, since falling over is not as big a deal lol"
15,"No not at all, I have plenty of male friends"
15,My coworker decided to pay for the lunch and I will repay once back at the office.
15,I think that is a good thing.
15,That was nice of him!
15,"Yeah, although now you have me thinking about it, I don't think I am very comfortable about how much time he spends with her..."
15,Next time I will make sure not to forget my wallet again.
15,I can see why that would bother you.
15,I bet it was a pretty embarassing situation! I've forgotten my wallet before.
15,"haha yeah, so how about you, do you have a partner?"
15,Yes I do have a partner and I am comfortable with him having females friends.
15,"Yes it was!, but it was a lesson learned  to not forget again."
15,That's great to hear. What's your favorite activity to do with him?
15,Definitely. Where did you go to lunch?
15,Went to a nice sushi spot around down town.
15,I love sushi! We should go sometime!
15,That would be a good idea to meet up and enjoy some lovely sushi.
15,We both love riding motorcycles and playing put-put.
15,"Oh cool, i have played put-put a few times but I'm really bad at it"
15,I am free on Saturday for dinner. I think there is a place downtown that has an all-you-can eat sushi option. Interested?
16,My coworker decided to pay for the lunch and I will repay once back at the office.
16,it is harder some days than others. but it is good you get along with your mom so well
16,That was nice of him!
16,Next time I will make sure not to forget my wallet again.
16,I bet it was a pretty embarassing situation! I've forgotten my wallet before.
16,It is.  How was your relationship with your parents?
16,"it was good, this happened in my adult life so we all had work and stuff and maybe did not socialize as often as we could have"
16,I understand.  I guess I tend to socialize with my cat the most.  He is almost like family.
16,i think pets can be family for sure. just hanging out with them and petting them can be really calming
16,"Yes it was!, but it was a lesson learned  to not forget again."
16,"Most definitely, except when he knocks stuff off of tables.  Do you have any pets?"
16,Definitely. Where did you go to lunch?
16,"i used to have a cat that was really bad about that, couldn't have anything on tables at all. but now i have a dog and a couple cats"
16,Went to a nice sushi spot around down town.
16,How does your dog get along with the cats?
16,they mostly just ignore each other. the cats are actually bigger than him so they never really seem worried about his presence
16,I love sushi! We should go sometime!
17,it is harder some days than others. but it is good you get along with your mom so well
17,Haha I wish! My ex texted me the other day. She apparently still loves me.
17,"Huh, but why did you break up in the first place?"
17,It is.  How was your relationship with your parents?
17,We wanted different things in the future. She wanted kids and I didn't. Stuff like that.
17,Do you think either of you have changed your minds on that stuff?
17,"it was good, this happened in my adult life so we all had work and stuff and maybe did not socialize as often as we could have"
17,I have. I think I want kids now.
17,I understand.  I guess I tend to socialize with my cat the most.  He is almost like family.
17,Maybe you guys could try hanging out again before jumping back into dating. Did you stay friends after breaking up?
17,i think pets can be family for sure. just hanging out with them and petting them can be really calming
17,"Most definitely, except when he knocks stuff off of tables.  Do you have any pets?"
17,"i used to have a cat that was really bad about that, couldn't have anything on tables at all. but now i have a dog and a couple cats"
17,"Somewhat. We have both dated a couple other people, but we see each other at parties and stuff. Hanging out before dating is a good idea."
18,Haha I wish! My ex texted me the other day. She apparently still loves me.
18,Do you have a favorite game?
18,Yes I do and that is playing Sudoka.
18,Sudoka? Is that similar to sudoku?
18,"Huh, but why did you break up in the first place?"
18,We wanted different things in the future. She wanted kids and I didn't. Stuff like that.
18,"This one is the ultimate version of it, it is worth checking out"
18,I'll definitely check it out! Where do you play?
18,Do you think either of you have changed your minds on that stuff?
18,I just at home when I have the chance.
18,"Nice! Do you have a book of sudoka, or do you play on a computer?"
18,I have. I think I want kids now.
18,Maybe you guys could try hanging out again before jumping back into dating. Did you stay friends after breaking up?
18,I do have several books that I like to play through.
18,Nice! I am heading to the mall in Chicago tomorrow. I will have to pick up a book!
18,"Somewhat. We have both dated a couple other people, but we see each other at parties and stuff. Hanging out before dating is a good idea."
19,Do you have a favorite game?
19,Interesting. I've never played billiards.
19,In the past the umbrella term was billiards
19,Is it similar to snooker?
19,I have never heard of this before.
19,Yes I do and that is playing Sudoka.
19,I think snooker is another cue sport. Not sure how similar it is to billiards.
19,Sudoka? Is that similar to sudoku?
19,"This one is the ultimate version of it, it is worth checking out"
19,"That information is very interesting, will have to check that out."
19,I'll definitely check it out! Where do you play?
19,Look up Ronnie O'Sullivan sometime. I've heard he is pretty good at snooker.
19,I just at home when I have the chance.
19,"Nice! Do you have a book of sudoka, or do you play on a computer?"
19,thanks i will have to look into it .
20,Interesting. I've never played billiards.
20,"i have to kick my cats out of bed, they never let me get any sleep"
20,ok good. cats can see in near darkness. I scared about dark so my pet is useful for me
20,In the past the umbrella term was billiards
20,Is it similar to snooker?
20,I have never heard of this before.
20,that is good then. do they sleep with you all night?
20,yes i do . depending on them
20,what pets do you have?
20,I think snooker is another cue sport. Not sure how similar it is to billiards.
20,I have just one and it is a good companion animal
20,"That information is very interesting, will have to check that out."
20,it sounds like it does a good job. is it a cat?
20,Look up Ronnie O'Sullivan sometime. I've heard he is pretty good at snooker.
20,"Yes, it is a cat that I rescued. "
20,thanks i will have to look into it .
20,"rescuing is good, i have never had a pet that wasn't rescued."
21,"i have to kick my cats out of bed, they never let me get any sleep"
21,"Definitely! Hot dogs, brats, hamburgers, everything!"
21,ok good. cats can see in near darkness. I scared about dark so my pet is useful for me
21,That sounds like fun! What are you planning to do at the lake.
21,"Fish, hang out, play some games, swim, and relax"
21,that is good then. do they sleep with you all night?
