sequenceID,text
41,"That's cool, what's the plan."
41,you dont get nervous to speak infront of crowds?
41,"Extremely nervous, actually. But I haven't had that big of an issue since my speech course in college. Lucky for me I passed."
41,well there's a new restaurant that we'd like to try out. they have a wine bar
41,What's the menu look like?
41,authentic american cuisine.. we're pretty much going for the bar and wine selection
41,there is a course for anything isnt there
41,Do they ever have a wine tasting?
41,Honestly yes. You didn't take a recommended speech course in college? I swear it was mandatory
41,"not sure , there may be many during the week. seeing that they're new in town "
41,Sounds like something my wife would drag me to.
41,i didnt take it that seriously. honestly hate speeches
42,anything i do i try to do great at it. i'd say i gave it my best. i was satisfied 
42,It's amazing how a little kindness from strangers can go such a long way.
42,"I understand, but at least you were prepared and you feel accomplished."
42,"He thought I was cute and old fashioned since I wore a locket. I still love to line dry my clothes! Nothing better, I say!"
42,I agree with you! The way linens smell after being air dried is way better than any dryer sheet
42,"A word of advice, always hang your clothes higher than your goats can reach! I learned that early on living on a homestead! Explains the missing socks!"
42,you dont get nervous to speak infront of crowds?
42,"Extremely nervous, actually. But I haven't had that big of an issue since my speech course in college. Lucky for me I passed."
42,Oh wow yeah! I never thought about that. I don't raise animals but my neighbor does. I do like to hunt deer from time to time.
42,there is a course for anything isnt there
42,"We've had so many animals but their all for slaughter or use on the farm, chickens for eggs, goats for milk, ya know.... we hunt a lot as well."
42,Honestly yes. You didn't take a recommended speech course in college? I swear it was mandatory
42,i didnt take it that seriously. honestly hate speeches
42,"I get that. Even though it was mandatory, I'm glad I took it since I obviously needed it due to me running for political office back in 2004"
42,"That's great. I love animals, but I also love the thrill of the hunt. I use a bow to make it more interesting."
43,It's amazing how a little kindness from strangers can go such a long way.
43,led zepelin. they are legendary
43,Are you a fan?
43,im  a fan of geat bass guitar players
43,Who are favorites?
43,"He thought I was cute and old fashioned since I wore a locket. I still love to line dry my clothes! Nothing better, I say!"
43,"Alice in chains, rocking since 1987"
43,Great band. Can't go wrong with them.
43,I agree with you! The way linens smell after being air dried is way better than any dryer sheet
43,"A word of advice, always hang your clothes higher than your goats can reach! I learned that early on living on a homestead! Explains the missing socks!"
43,Oh wow yeah! I never thought about that. I don't raise animals but my neighbor does. I do like to hunt deer from time to time.
43,"We've had so many animals but their all for slaughter or use on the farm, chickens for eggs, goats for milk, ya know.... we hunt a lot as well."
43,i'm telling you. im in the mood for mexican food 
43,"That's great. I love animals, but I also love the thrill of the hunt. I use a bow to make it more interesting."
43,OMG...I love Mexican food!
44,led zepelin. they are legendary
44,Probably just amp up the place and re-sell it. I can move in with my girlfriend
44,Are you a fan?
44,im  a fan of geat bass guitar players
44,Who are favorites?
44,that's a good option. you could really save 
44,Well I don't need the money. My dad is the Vice Presidents dentist and my mom teaches the VP's kids
44,"Alice in chains, rocking since 1987"
44,Great band. Can't go wrong with them.
44,wow. talk about privilege. good for you man. you must have the best teeth in town
44,i'm telling you. im in the mood for mexican food 
44,OMG...I love Mexican food!
44,"Oh yes I do. I'm like Chip Skylark. And my girlfriend is a famous Youtuber, you might of heard of her?"
44,really? whats your favourite dish
44,what type of channel does she run?
44,"Anything, I haven't had any dish I haven't enjoyed."
44,"She does make-up tutorials and lifestyle vlogs, she's very popular and extremely wealthy"
44,"man, i like a good guac"
44,wow how does it feel to have a famous gf. you must be really proud
44,"Extremely, do you know who I'm talking about? Do you watch her videos too?"
44,So do I.  Anything with avocado is great. I love the freshness it brings.
45,Probably just amp up the place and re-sell it. I can move in with my girlfriend
45,Maybe
45,I am used to living in a small city I've never lived anywhere else. How many people are in your town?
45,"the small place, where one was often forced to be guarded in many"
45,that's a good option. you could really save 
45,What do you mean?
45,Well I don't need the money. My dad is the Vice Presidents dentist and my mom teaches the VP's kids
45,wow. talk about privilege. good for you man. you must have the best teeth in town
45,"Towns of more than 50,000 people "
45,What about them?
45,"Oh yes I do. I'm like Chip Skylark. And my girlfriend is a famous Youtuber, you might of heard of her?"
45,what type of channel does she run?
45,"She does make-up tutorials and lifestyle vlogs, she's very popular and extremely wealthy"
45,you ask the qustion
45,"i am not sure what you mean, You mentioned big cities"
45,Yes
45,Do you like them?
45,ya
45,Cool.
45,wow how does it feel to have a famous gf. you must be really proud
46,Maybe
46,that's great. did you get a good deal?
46,I am used to living in a small city I've never lived anywhere else. How many people are in your town?
46,yea i got a great deal actually. have you been on a vessel
46,i have not. is it safe?
46,of coarse its safe super fun too
46,do you have extra fishing gear
46,"the small place, where one was often forced to be guarded in many"
46,What do you mean?
46,yea i got everything youd need
46,"Towns of more than 50,000 people "
46,i really cant wait. do you get great catches often
46,all the time best part is we have a fat bbq afterwards too
46,that sounds super rewarding
46,What about them?
46,yep its awesome
46,you ask the qustion
46,what do you do on bad days when there's no catch. trip to the store ? haha
46,"i am not sure what you mean, You mentioned big cities"
46,Yes
46,i havent had a bad day yet
47,that's great. did you get a good deal?
47,"Yes, finally. Do you enjoy long drives?"
47,Yes they are great. I love just getting in the car and stoppingonly when I am in another place.
47,I agree. One time I drove for 10 hours in one direction and had no idea where I was going
47,yea i got a great deal actually. have you been on a vessel
47,Was this before GPS or did you just leave it off
47,I turned the GPS off and just drove and drove. Thats how I found the house I am moving too
47,i have not. is it safe?
47,Wow what a nice coincidence!
47,I always look for mountains and snow when I am going somewhere new so that I can use my snowboard
47,of coarse its safe super fun too
47,That sounds like a lot of fun! Which mountains?
47,do you have extra fishing gear
47,yea i got everything youd need
47,i really cant wait. do you get great catches often
47,The rockies are my favorite but I love them all! What are your hobbies
47,"I like movies, especially emotional ones."
47,all the time best part is we have a fat bbq afterwards too
47,Emotional like sad or happy?
48,"Yes, finally. Do you enjoy long drives?"
48,"i work as a personal trainer , 5 days a week so i had enough strength to pull myself out of the window before the engine exploded."
48,Wow! That is amazing! You are so lucky. I am not that strong. It must have been scary.
48,Yes they are great. I love just getting in the car and stoppingonly when I am in another place.
48,"I live n Las Vegas, Nevada so I was bound to encounter a drunk driver one day. I thank God for saving my life that night."
48,"Yes, God is good! I have never been to Vegas. How long have you lived there?"
48,I agree. One time I drove for 10 hours in one direction and had no idea where I was going
48,Was this before GPS or did you just leave it off
48,I turned the GPS off and just drove and drove. Thats how I found the house I am moving too
48,My whole life. Born and raised! I'm thankful I found Jesus before I found out about the sins of Sin City.
48,"Ha! So true! I am from Tennessee, the Bible Belt. We sure know Jesus!"
48,Wow what a nice coincidence!
48,"I love tennessee! I have property in the small town of 5000, Ashland City that I visit often. Gets me away from the city."
48,I always look for mountains and snow when I am going somewhere new so that I can use my snowboard
49,"i work as a personal trainer , 5 days a week so i had enough strength to pull myself out of the window before the engine exploded."
49,Wow. is there repercussions 
49,"Yes, if a whistleblower tells, the company can get in trouble. They can get big fines for exploitation of workers."
49,Wow! That is amazing! You are so lucky. I am not that strong. It must have been scary.
49,"I live n Las Vegas, Nevada so I was bound to encounter a drunk driver one day. I thank God for saving my life that night."
49,"Yes, God is good! I have never been to Vegas. How long have you lived there?"
49,Thats terrible have you ever witnessed this personally
49,My whole life. Born and raised! I'm thankful I found Jesus before I found out about the sins of Sin City.
49,"Ha! So true! I am from Tennessee, the Bible Belt. We sure know Jesus!"
49,"No, I own a small business. I can only afford to pay my workers minimum wage, but I treat them well. I have heard stories about horrible working conditions."
49,"I love tennessee! I have property in the small town of 5000, Ashland City that I visit often. Gets me away from the city."
49,I work night shift at a hotel. I hate my job
49,I am so sorry to hear that. Why do you hate your job?
49,I dont enjoy working nights. I would rather work during the day
49,"Yes, that is hard to work the night shift. Is there a reason your boss won't let you work days?"
49,That is awesome! Where is Ashland City? 
49,There is no openings and I was the last to start
50,Wow. is there repercussions 
50,"No, I work with chemicals. Did you always want to be an engineer?"
50,"Yes, if a whistleblower tells, the company can get in trouble. They can get big fines for exploitation of workers."
50,Thats terrible have you ever witnessed this personally
50,Yes I have wanted to be an engineer for many years.
50,Likewise. My parents were scientist and it inspired me to follow in that field. Why are you in this field?
50,I want to innovate for future generations.
50,"No, I own a small business. I can only afford to pay my workers minimum wage, but I treat them well. I have heard stories about horrible working conditions."
50,Very nice. Any ideas so far?
50,"Yeah, we need to reduce emissions right now."
50,I agree. Currently at my workplace we have a team working on reducing emissions. Are you currently working anywhere?
50,I work night shift at a hotel. I hate my job
50,I am so sorry to hear that. Why do you hate your job?
50,"Yes, I work in a medium sized firm in Portland. Where are you from?"
50,I dont enjoy working nights. I would rather work during the day
50,"Yes, that is hard to work the night shift. Is there a reason your boss won't let you work days?"
50,I currently reside in a small town near Illinois. Have you ever been to Illinois?
50,There is no openings and I was the last to start
50,"Yes, I have a few times, but not recently. Do you live alone, or with family?"
51,"No, I work with chemicals. Did you always want to be an engineer?"
51,Netflix original shows are the best in my opinon 
51,I do like the Netflix originals. I also love the British shows as I am from London. You will love Netflix. There are so many choices!
51,Me and my family all really enjoy Netflix!
51,Yes I have wanted to be an engineer for many years.
51,Likewise. My parents were scientist and it inspired me to follow in that field. Why are you in this field?
51,Do you have children?
51,4 boys and 2 girls. I have a huge family!
51,I want to innovate for future generations.
51,Very nice. Any ideas so far?
51,Wow! That is wonderful! They will get so much use out of Netflix. The selection for kids is terrific.
51,"Yeah, we need to reduce emissions right now."
51,We have watched every show on there I think!
51,I agree. Currently at my workplace we have a team working on reducing emissions. Are you currently working anywhere?
52,Netflix original shows are the best in my opinon 
52,Does your mom get scared?
52,Not really! It's mostly myself who gets scared.
52,I do like the Netflix originals. I also love the British shows as I am from London. You will love Netflix. There are so many choices!
52,Me and my family all really enjoy Netflix!
52,Do you have children?
52,4 boys and 2 girls. I have a huge family!
52,Im not a big fan of heights myselg!
52,"My sister is the opposite of you. She has a passion for heights - she could dance along a cliff edge, it wouldn't bother her a bit."
52,Wow that sounds awful to me! I would much rather be in a casino lol
52,Wow! That is wonderful! They will get so much use out of Netflix. The selection for kids is terrific.
52,We have watched every show on there I think!
52,Yeah I don't have the best luck in casinos either.
52,I still like to gamble though
52,I can believe it. It is quite addictive. We have binged quite a few shows. Do you have a favorite show?
53,I am 22. I also love science
53,"I have trouble remembering, I just think about how they taste"
53,"I love eating barbeque sandwiches. We served them at my birthday party, along with pizza puffs. I love science too, but not as much as pizza puffs."
53,I am a scientist for a living
53,"Yeah, it's hard remembering anything if you're like myself, working the same job for 8 whole years. "
53,i am 19 and still in school. Scientist sounds interesting!
53,It is the best. That and the beatles haha!
53,Oh wow that't a long time to be in one job! What do you do?
53,oh yes the beatles are the best of the best. but are they better than barbeque sandwiches? 
53,"I work in marketing. It's kinda cut throat sometimes. When I get home, I put some rolling stones on and it all melts away."
53,Oh yeah
53,too bad the beatles are not around anymore. Sometimes I like to imagine John Lennon is right here with me.
53,He is in spirit
53,Mmm what a way to relax!
53,"Yes, he was the best musician ever."
53,It certainly does put me in a good emotional state. They're my favorite band after all.
53,"Cool, I prefer opera myself, there's just something about it that soothes me"
53,They all were great
54,"I have trouble remembering, I just think about how they taste"
54,Thanks for your support! Hopefully I will make it as an actor!
54,"Yeah, it's hard remembering anything if you're like myself, working the same job for 8 whole years. "
54,"You're welcome. Well, an actor in the background is still a very important actor. Maybe you'll be in a lead role someday!"
54,"Thanks, you're right! How about you? What do you want to do?"
54,Make more money! It totally blows working at scrubway. 
54,Oh wow that't a long time to be in one job! What do you do?
54,"I work in marketing. It's kinda cut throat sometimes. When I get home, I put some rolling stones on and it all melts away."
54,I can imagine. What do you think you would be good at?
54,Mmm what a way to relax!
54,It certainly does put me in a good emotional state. They're my favorite band after all.
54,"Not too sure, but I never want to disappoint my family. That's why I'm in college for engineering."
54,"Cool, I prefer opera myself, there's just something about it that soothes me"
54,"Nice, well engineering can definitely get you a high paying job"
54,"Honestly, opera can be so cool."
54,"It totally can. Anyway enough about me, you got any cool hobbies?"
54,"I'm glad you think so, most people just don't appreciate it at all"
54,"Theatre pretty much consumes my life at the moment, but I love it"
54,Most people don't appreciate anything worthwhile.
55,Thanks for your support! Hopefully I will make it as an actor!
55,"Nah, we never could afford the fancy things. Best I had was out of a can!"
55,"You're welcome. Well, an actor in the background is still a very important actor. Maybe you'll be in a lead role someday!"
55,"Thanks, you're right! How about you? What do you want to do?"
55,"Well, you get experience points on that. Hopefully, the next dish is better."
55,Make more money! It totally blows working at scrubway. 
55,I can imagine. What do you think you would be good at?
55,"Not too sure, but I never want to disappoint my family. That's why I'm in college for engineering."
55,"Nice, well engineering can definitely get you a high paying job"
55,"It totally can. Anyway enough about me, you got any cool hobbies?"
55,"Theatre pretty much consumes my life at the moment, but I love it"
55,I'm sure it would be if I could find a way to heat it up! Usually that makes it better.
55,Any favorite actors?
55,"You ate the dish cold?! That sounds vile, it really needs to be hot."
55,Yeah I did. But I was on my boat fishing at the time. I was in the middle of the lake and got hungry. That can was all I had.
55,I suppose if you're starving you wouldn't really care if its hot or cold. Why didn't you eat one of the fish that you caught?
55,Can I say myself? Haha
55,Hadn't caught any yet. Plus they are hard to cook on a little boat. Do you eat raw fish?
55,Of course! But who is #2?
56,"Nah, we never could afford the fancy things. Best I had was out of a can!"
56,I gave the cash I had to a homeless guy by the art gallery.
56,is he still there maybe? hope so. Remember the movie Groundhog Day. It was the homeless guys last day
56,I don't watch much TV. I spend most days painting. 
56,"TV is good to fall asleep to, i've wanted to start painting but being a nurse keeps me busy"
56,"Well, you get experience points on that. Hopefully, the next dish is better."
56,I'm sure it would be if I could find a way to heat it up! Usually that makes it better.
56,"You ate the dish cold?! That sounds vile, it really needs to be hot."
56,Yeah I did. But I was on my boat fishing at the time. I was in the middle of the lake and got hungry. That can was all I had.
56,I suppose if you're starving you wouldn't really care if its hot or cold. Why didn't you eat one of the fish that you caught?
56,Hadn't caught any yet. Plus they are hard to cook on a little boat. Do you eat raw fish?
56,"How do you handle being a nurse, working with so many people? I get so nervous around people."
56,I like being busy and helping people is fun.
56,I guess I'll always be a shy person. I doubt that my date calls me back. I think you were right.
56,"Yes I suppose it would be hard to cook. I've had sushi which is raw, is it not?"
57,I do
57,"Awesome! I was so close to there when I was hiking one day, but I had to return home for it was getting dark."
57,"Haha, I don't like walking in the dark either."
57,"That's excellent, what's your favorite, I have tons of favorites."
57,Probably Nike tennis shoes.
57,"I love nike designs, their footwear is some of the most comfortable and stylish stuff I've ever worn."
57,"Indeed, speaking of dark, what type of chocolate do you prefer most? I prefer vegan 100 percent cocoa."
57,I like Almond milk chocolate.  I'm glad chocolate has health benefits as well.
57,"Me too! It contains so many antibiotics, no wonder it was used in medicine many years ago, and today as well."
57,Indeed it is. The children at the school I teach at always love to see my new shoes.
57,"Chocolate is not just good for the body, but for the soul as well."
57,"That's good. Speaking of good, do you like discovering new restaurants to eat at? "
57,"Very true, the ancients used it very often as a treat. Also, I think I meant antioxidants, not antibiotics... "
57,no worries; I knew what you meant.
57,Thanks! I'm glad there's someone whom understands chocolate and me!
57,mhm. I always try out a new restraunt once a month after work.
57,"Since you like it so much, you should visit Chocolate World if you get the chance. There are shops and restaurants there too."
57,I enjoy dining out as well . what is your favorite restaurant so far?
57,El Chico is my favorite restraunt.
57,"Cool, thanks! Perhaps I could hike there someday soon during the spring time."
57,I love eating there as well. The food is always amazing and always up to quality.
58,"Awesome! I was so close to there when I was hiking one day, but I had to return home for it was getting dark."
58,They're 6 and 9
58,"Haha, I don't like walking in the dark either."
58,That is so neat. Are they at the age that they like the Australian Band Hi-5? My kids love to binge watch their show!
58,Yes they absolutely love it!! They watch it on their tablets in the car!
58,That is so awesome. I hope it gets there before this weekend so you can binge it!
58,"Indeed, speaking of dark, what type of chocolate do you prefer most? I prefer vegan 100 percent cocoa."
58,Oh absolutely! It's amazing.
58,My 5-year-old twins love it!
58,Oh I bet they do! Are they boys or girls?! What are there names?
58,A boy and a girl. Thomas and Abigale.
58,I like Almond milk chocolate.  I'm glad chocolate has health benefits as well.
58,"Me too! It contains so many antibiotics, no wonder it was used in medicine many years ago, and today as well."
58,"Chocolate is not just good for the body, but for the soul as well."
58,"Very true, the ancients used it very often as a treat. Also, I think I meant antioxidants, not antibiotics... "
58,no worries; I knew what you meant.
58,oh that's adorable. Are they well behaved?
58,They are most of the time; Thomas always seems to get into trouble when he comes with me to feed the horses.
58,Thanks! I'm glad there's someone whom understands chocolate and me!
59,They're 6 and 9
59,"Indeed, but more nervous. Ironic for I teach yoga..."
59,"Hey, I bet that's an interesting job. I actually have never done yoga! I keeping meaning to, but sometimes I hear voices telling me that it's a bad idea!"
59,"Thanks, I teach yoga on weekdays, I work at the red cross other days. I hope this date day goes well."
59,I've got my fingers crossed for you! Where are you going?
59,"Thanks, I'm going to the gym where I used to do yoga a few times a week. I turned it into a living by recording my yoga and teaching."
59,Sounds awesome! We have a fitness center locally that offers tanning beds and massages.  i was thinking of joining just for that.
59,That is so neat. Are they at the age that they like the Australian Band Hi-5? My kids love to binge watch their show!
59,Yes they absolutely love it!! They watch it on their tablets in the car!
59,That is so awesome. I hope it gets there before this weekend so you can binge it!
59,"That sounds great, I would love too. Also, talking to you has made me less nervous. Thanks."
59,definitely ! it was nice chatting with you too !
59,Oh absolutely! It's amazing.
59,My 5-year-old twins love it!
59,Oh I bet they do! Are they boys or girls?! What are there names?
59,"Thanks, I'm almost getting ready to go now. I'm looking forward to that meeting you offered!"
59,A boy and a girl. Thomas and Abigale.
59,oh that's adorable. Are they well behaved?
59,Yes I am looking forward to the meeting too! What are you going to wear to your date?!
60,That's cool! What was the heaviest weight you lifted?
60,Do they have a car show associated with it? I like looking at suped up toyota cars.
60,"My max is 180 lbs, but different days I target different muscle groups with different exercises."
60,"i only like toyota vehicles. I have a corolla and they drive amazingly,"
60,"Excellent, thank's for letting me know. I remember taking protein supplements back in the day, they were sorta good. Do you take any?  "
60,I had a corolla for several years too. I want to get a Tacoma pickup soon.
60,"Yes, I enjoy the peanut butter protein powder a few times a week.  I also like to eat clean and meal prep. Do you meal prep?"
60,Cool. I enjoy cocoa and milk as a source of protein. I used to meal prep often before going to class. 
60,its almost the hollidays. You're combination reminds me of hot chocolate. I just drink the protein shake before working out. What did you study?
60,Nice - They are very fun to drive. I love these music festivals though. Love the food too!
60,What kind of food do they have there?
60,Pretty much food you would find at a fair. All things fried...including cheese. I LOVE cheese.
60,"Thanks, I usually heat the combination, and thus the drink is a healthier 3 ingredient hot cocoa, water, milk cocoa. I studied math and art. "
60,Do you like fried cheese? That is one of my favorites.
60,oh yes! Cheese is one of my favorite foods!
60,i love queso too.
60,That's awesome. I was terribel at math.
60,Thanks. I think I did a bit better in art than math.
60,especially white queso with some chips - yes! What is your favorite type of food?
60,Nice. I always did pretty well in art.  How long were you in school?
60,"Thanks! I was in school for about 2 years, almost..."
60,I like Mexican food a lot. We are doing a taco bar for dinner.
60,That is a while. Do you work now?
61,Do they have a car show associated with it? I like looking at suped up toyota cars.
61,"It was great. I enjoyed eating it while listening to Bach,"
61,cool ! i'm listening to bach now
61,"i only like toyota vehicles. I have a corolla and they drive amazingly,"
61,I had a corolla for several years too. I want to get a Tacoma pickup soon.
61,Nice - They are very fun to drive. I love these music festivals though. Love the food too!
61,Really. Do you enjoy other classical composers?
